{
  "$schema": "./ui-measurement.schema.json",
  "contractVersion": 1,
  "baseline": {
    "product": "Rebased",
    "version": "1.1.11",
    "platform": "macOS",
    "architecture": "arm64",
    "authority": "installed-app-first"
  },
  "coordinateSystem": {
    "origin": "screen-top-left",
    "unit": "physical-pixel",
    "colorSpace": "srgb-8bit"
  },
  "surfaces": [
    {
      "id": "welcome",
      "title": "Welcome with recent projects",
      "fixture": "recent-projects",
      "viewport": { "width": 800, "height": 650 },
      "openAction": "Start isolated Rebased with no project restored",
      "measurements": {
        "rectangles": [
          { "id": "window", "selectorHint": "application window", "required": true, "value": null },
          { "id": "sidebar", "selectorHint": "welcome category sidebar", "required": true, "value": null },
          { "id": "project-list", "selectorHint": "recent projects list", "required": true, "value": null },
          { "id": "open-button", "selectorHint": "Open project action", "required": true, "value": null }
        ],
        "texts": [
          { "id": "projects-tab", "role": "navigation item", "required": true, "value": null },
          { "id": "open-action", "role": "button", "required": true, "value": null },
          { "id": "clone-action", "role": "button", "required": true, "value": null }
        ],
        "colors": [
          { "id": "window-background", "sampleHint": "empty welcome content background", "value": null },
          { "id": "selection-background", "sampleHint": "selected recent project center", "value": null }
        ]
      },
      "interaction": {
        "initialFocus": null,
        "tabSequence": [],
        "shiftTabSequence": [],
        "escapeStack": [],
        "confirmations": []
      },
      "source": { "status": "pending", "product": "Rebased", "version": "1.1.11", "capturedAt": null, "evidenceIds": [], "notes": [] },
      "implementation": {
        "entrypoints": ["src/App.tsx:AppContent", "src/App.tsx:WelcomeTitlebar"],
        "components": ["src/components/WelcomeWorkspace.tsx:WelcomeWorkspace"],
        "stateOwners": ["AppContent.workspace", "WelcomeWorkspace.section", "WelcomeWorkspace.query", "WelcomeWorkspace.selectedProject", "recentProjects"],
        "styleAnchors": ["tw.welcomeWorkspace", "tw.welcomeSidebar", "tw.welcomeNavigation", "tw.welcomeProjects"],
        "tests": ["src/components/WelcomeWorkspace.test.ts", "tests/app.spec.ts", "electron-tests/app.spec.ts"]
      }
    },
    {
      "id": "workbench-clean",
      "title": "Clean repository workbench",
      "fixture": "clean-main-with-remote",
      "viewport": { "width": 1184, "height": 768 },
      "openAction": "Open clean fixture and wait for repository refresh",
      "measurements": {
        "rectangles": [
          { "id": "titlebar", "selectorHint": "main toolbar", "required": true, "value": null },
          { "id": "left-tool-stripe", "selectorHint": "left tool-window bar", "required": true, "value": null },
          { "id": "left-pane", "selectorHint": "default left tool window", "required": true, "value": null },
          { "id": "log-pane", "selectorHint": "Git log center pane", "required": true, "value": null },
          { "id": "review-pane", "selectorHint": "revision review right pane", "required": true, "value": null }
        ],
        "texts": [
          { "id": "default-left-tool", "role": "selected tool-window tab", "required": true, "value": null },
          { "id": "log-tab", "role": "editor tab", "required": true, "value": null },
          { "id": "branch-control", "role": "toolbar button", "required": true, "value": null }
        ],
        "colors": [
          { "id": "workbench-background", "sampleHint": "center of editor background", "value": null },
          { "id": "pane-border", "sampleHint": "log/review vertical divider", "value": null }
        ]
      },
      "interaction": { "initialFocus": null, "tabSequence": [], "shiftTabSequence": [], "escapeStack": [], "confirmations": [] },
      "source": { "status": "pending", "product": "Rebased", "version": "1.1.11", "capturedAt": null, "evidenceIds": [], "notes": [] },
      "implementation": {
        "entrypoints": ["src/App.tsx:RepositoryWorkspace"],
        "components": ["src/components/ProjectToolWindow.tsx:ProjectToolWindow", "src/components/CommitLog.tsx:CommitLog", "src/components/DetailsPane.tsx:DetailsPane"],
        "stateOwners": ["RepositoryWorkspace.projectOpen", "RepositoryWorkspace.repositoryViewMode", "RepositoryWorkspace.logOpen", "RepositoryWorkspace.selectedOids", "workspacePersistence"],
        "styleAnchors": ["tw.workbench", "tw.workbenchContent", "tw.mainPanes", "tw.detailsPane"],
        "tests": ["tests/app.spec.ts", "electron-tests/app.spec.ts"]
      }
    },
    {
      "id": "workbench-dirty",
      "title": "Dirty repository default workbench",
      "fixture": "dirty-staged-unstaged-untracked",
      "viewport": { "width": 1184, "height": 768 },
      "openAction": "Open dirty fixture in a fresh profile and wait for status refresh",
      "measurements": {
        "rectangles": [
          { "id": "left-pane", "selectorHint": "default dirty-repository tool window", "required": true, "value": null },
          { "id": "changes-tree", "selectorHint": "changed files tree", "required": true, "value": null },
          { "id": "commit-composer", "selectorHint": "commit message and actions", "required": true, "value": null },
          { "id": "editor", "selectorHint": "main editor/log area", "required": true, "value": null }
        ],
        "texts": [
          { "id": "default-left-tool", "role": "selected tool-window tab", "required": true, "value": null },
          { "id": "changes-title", "role": "heading", "required": true, "value": null },
          { "id": "commit-action", "role": "button", "required": true, "value": null }
        ],
        "colors": [{ "id": "changed-file-selection", "sampleHint": "selected change row", "value": null }]
      },
      "interaction": { "initialFocus": null, "tabSequence": [], "shiftTabSequence": [], "escapeStack": [], "confirmations": [] },
      "source": { "status": "pending", "product": "Rebased", "version": "1.1.11", "capturedAt": null, "evidenceIds": [], "notes": [] },
      "implementation": {
        "entrypoints": ["src/App.tsx:RepositoryWorkspace.commitToolWindow"],
        "components": ["src/components/ChangesWorkspace.tsx:ChangesWorkspace", "src/components/DiffViewer.tsx:DiffViewer"],
        "stateOwners": ["RepositoryWorkspace.repositoryViewMode", "RepositoryWorkspace.changeSelection", "RepositoryWorkspace.commitDraft", "RepositoryWorkspace.changesNavigatorWidth", "RepositoryWorkspace.commitRailWidth"],
        "styleAnchors": ["tw.changesWorkspace", "tw.changesToolWindow", "tw.commitRail"],
        "tests": ["src/components/ChangesWorkspace.test.ts", "tests/app.spec.ts", "electron-tests/app.spec.ts"]
      }
    },
    {
      "id": "log-diff",
      "title": "Log selection and file diff",
      "fixture": "history-branched-with-file-changes",
      "viewport": { "width": 1184, "height": 768 },
      "openAction": "Select the newest non-merge commit then its first changed file",
      "measurements": {
        "rectangles": [
          { "id": "filters", "selectorHint": "log filters toolbar", "required": true, "value": null },
          { "id": "log-header", "selectorHint": "Git log column header", "required": true, "value": null },
          { "id": "log-row", "selectorHint": "selected commit row", "required": true, "value": null },
          { "id": "graph-cell", "selectorHint": "selected commit graph cell", "required": true, "value": null },
          { "id": "changed-files", "selectorHint": "revision changed files tree", "required": true, "value": null },
          { "id": "diff", "selectorHint": "selected file diff", "required": true, "value": null }
        ],
        "texts": [
          { "id": "columns", "role": "column headers", "required": true, "value": null },
          { "id": "details-heading", "role": "heading", "required": true, "value": null }
        ],
        "colors": [
          { "id": "graph-primary", "sampleHint": "primary branch line center", "value": null },
          { "id": "graph-secondary", "sampleHint": "secondary branch line center", "value": null },
          { "id": "selected-row", "sampleHint": "selected log row away from text", "value": null }
        ]
      },
      "interaction": { "initialFocus": null, "tabSequence": [], "shiftTabSequence": [], "escapeStack": [], "confirmations": [] },
      "source": { "status": "pending", "product": "Rebased", "version": "1.1.11", "capturedAt": null, "evidenceIds": [], "notes": [] },
      "implementation": {
        "entrypoints": ["src/App.tsx:RepositoryWorkspace history mode"],
        "components": ["src/components/CommitLog.tsx:CommitLog", "src/components/CommitGraph.tsx:CommitGraph", "src/components/DetailsPane.tsx:DetailsPane", "src/components/DiffViewer.tsx:DiffViewer"],
        "stateOwners": ["RepositoryWorkspace.selectedOids", "RepositoryWorkspace.commitFiles", "RepositoryWorkspace.historySelectedPath", "CommitLog.filters", "CommitLog.order"],
        "styleAnchors": ["tw.logPane", "tw.commitScroller", "tw.commitRow", "tw.detailsPane", "tw.revisionFileList"],
        "tests": ["src/components/DetailsPane.test.ts", "tests/app.spec.ts", "electron-tests/app.spec.ts"]
      }
    },
    {
      "id": "changes-commit",
      "title": "Stage, partial stage, discard, commit and amend",
      "fixture": "dirty-partial-hunks",
      "viewport": { "width": 1184, "height": 768 },
      "openAction": "Open Commit tool window and select the first unstaged file",
      "measurements": {
        "rectangles": [
          { "id": "changes-toolbar", "selectorHint": "Commit tool-window header", "required": true, "value": null },